"Guid","Description","DisplayUrl","ExternalId","Family","IsActive","Name","ProductCode","QuantityUnitOfMeasure","SBQQ__AssetAmendmentBehavior__c","SBQQ__AssetConversion__c","SBQQ__BatchQuantity__c","SBQQ__BillingFrequency__c","SBQQ__BillingType__c","SBQQ__BlockPricingField__c","SBQQ__ChargeType__c","SBQQ__Component__c","SBQQ__CompoundDiscountRate__c","SBQQ__ConfigurationEvent__c","SBQQ__ConfigurationFieldSet__c","SBQQ__ConfigurationFields__c","SBQQ__ConfigurationFormTitle__c","SBQQ__ConfigurationType__c","SBQQ__ConfigurationValidator__c","SBQQ__ConfiguredCodePattern__c","SBQQ__ConfiguredDescriptionPattern__c","SBQQ__CostEditable__c","SBQQ__CostSchedule__c","SBQQ__CustomConfigurationPage__c","SBQQ__CustomConfigurationRequired__c","SBQQ__CustomerCommunityAvailability__c","SBQQ__DefaultPricingTable__c","SBQQ__DefaultQuantity__c","SBQQ__DescriptionLocked__c","SBQQ__DiscountCategory__c","SBQQ__DiscountSchedule__c","SBQQ__DynamicPricingConstraint__c","SBQQ__EnableLargeConfiguration__c","SBQQ__ExcludeFromMaintenance__c","SBQQ__ExcludeFromOpportunity__c","SBQQ__ExternallyConfigurable__c","SBQQ__GenerateContractedPrice__c","SBQQ__HasConfigurationAttributes__c","SBQQ__HasConsumptionSchedule__c","SBQQ__Hidden__c","SBQQ__HidePriceInSearchResults__c","SBQQ__IncludeInMaintenance__c","SBQQ__NewQuoteGroup__c","SBQQ__NonDiscountable__c","SBQQ__NonPartnerDiscountable__c","SBQQ__OptionLayout__c","SBQQ__OptionSelectionMethod__c","SBQQ__Optional__c","SBQQ__PriceEditable__c","SBQQ__PricingMethodEditable__c","SBQQ__PricingMethod__c","SBQQ__ProductPictureID__c","SBQQ__QuantityEditable__c","SBQQ__QuantityScale__c","SBQQ__ReconfigurationDisabled__c","SBQQ__SortOrder__c","SBQQ__Specifications__c","SBQQ__SubscriptionBase__c","SBQQ__SubscriptionCategory__c","SBQQ__SubscriptionPercent__c","SBQQ__SubscriptionPricing__c","SBQQ__SubscriptionTerm__c","SBQQ__SubscriptionType__c","SBQQ__TaxCode__c","SBQQ__Taxable__c","SBQQ__TermDiscountLevel__c","SBQQ__TermDiscountSchedule__c","SBQQ__UpgradeRatio__c","StockKeepingUnit"
012bd897-d0d3-4e2b-b469-66c997715887,Network Security Platform is a next-generation intrusion prevention system (IPS) that redefines how organizations block advanced threats.,"#N/A","#N/A",Software,true,Network Security Platform,NS-002,"#N/A",Default,One per quote line,"#N/A",Monthly,Arrears,Quantity,Recurring,false,"#N/A","#N/A","#N/A","#N/A","#N/A","#N/A","#N/A","#N/A","#N/A",false,"#N/A","#N/A",false,"#N/A","#N/A",1.0,false,"#N/A","#N/A","#N/A",false,false,false,false,"#N/A",false,false,false,false,false,false,false,false,"#N/A",Click,false,false,false,List,"#N/A",true,"#N/A",false,"#N/A","#N/A",List,"#N/A","#N/A",Fixed Price,1.0,Renewable,"#N/A",false,"#N/A","#N/A","#N/A","#N/A"
0153613d-fb00-46be-a594-6ffbc169f998,"Data Normalization Experts engage early in the project and assist customers in normalizing, cleaning, and de-duping data, and can perform upload and update functions.","#N/A","#N/A",Services,true,Data Normalization Expert,SV-DNE,"#N/A",Default,One per quote line,"#N/A","#N/A","#N/A",Quantity,One-Time,false,"#N/A","#N/A","#N/A","#N/A","#N/A","#N/A","#N/A","#N/A","#N/A",false,"#N/A","#N/A",false,"#N/A","#N/A",1.0,false,"#N/A","#N/A","#N/A",false,false,false,false,"#N/A",false,false,false,false,false,false,true,false,"#N/A",Click,false,false,false,List,"#N/A",true,"#N/A",false,"#N/A","#N/A",List,"#N/A","#N/A","#N/A","#N/A",Renewable,"#N/A",false,"#N/A","#N/A","#N/A","#N/A"
037b04ae-6bf7-40ee-b4e2-b377aaf4cdae,Policy Auditor software automates security audit processes and helps you report consistently and accurately against internal and external policies.,"#N/A","#N/A",Software,true,Policy Auditor,SS-006,"#N/A",Default,One per quote line,"#N/A",Annual,Advance,Quantity,Recurring,false,"#N/A","#N/A","#N/A","#N/A","#N/A","#N/A","#N/A","#N/A","#N/A",false,"#N/A","#N/A",false,"#N/A","#N/A",1.0,false,"#N/A","#N/A","#N/A",false,false,false,false,"#N/A",false,false,false,false,false,false,false,false,"#N/A",Click,false,false,false,List,"#N/A",true,"#N/A",false,"#N/A","#N/A",List,OnPremise,"#N/A",Fixed Price,12.0,"#N/A","#N/A",false,"#N/A","#N/A","#N/A","#N/A"
04837ccd-2d7e-474d-aeff-72d89e7f045c,"Intel E5-2680 v4 2.4GHz,35M Cache,9.60GT/s QPI,Turbo,HT,14C/28T (120W) - Designed for software defined infrastructure supercharged for efficiency, performance, and agile services delivery across cloud-native and traditional applications.","#N/A","#N/A",Hardware,true,Intel E5-2680 v4 2.4GHz,INTEL E5-2680,"#N/A",Allow Refund,One per quote line,"#N/A","#N/A","#N/A",Quantity,One-Time,true,"#N/A","#N/A","#N/A","#N/A","#N/A",Disabled,"#N/A","#N/A","#N/A",false,"#N/A","#N/A",false,"#N/A","#N/A",1.0,false,"#N/A","#N/A","#N/A",false,false,false,false,Do Not Generate,false,false,false,false,false,false,false,false,Tabs,Click,false,false,false,List,"#N/A",true,"#N/A",false,"#N/A","#N/A",List,"#N/A","#N/A","#N/A","#N/A",One-time,"#N/A",false,"#N/A","#N/A","#N/A","#N/A"
07876662-9f29-460d-aafd-0d1569c855a3,Universal Data Collection / Indexing combines high-end data collection with consumption based indexing and cloud machine learning analyzing real-time network data.,"#N/A","#N/A",Software,true,Universal Data Collection / Indexing,DC-008,"#N/A",Default,One per quote line,"#N/A",Monthly,Arrears,Quantity,Recurring,false,"#N/A","#N/A","#N/A","#N/A","#N/A","#N/A","#N/A","#N/A","#N/A",false,"#N/A","#N/A",false,"#N/A","#N/A",1.0,false,"#N/A","#N/A","#N/A",false,false,false,false,"#N/A",false,true,false,false,false,false,true,false,"#N/A",Click,false,false,false,List,"#N/A",true,"#N/A",false,"#N/A","#N/A",List,"#N/A","#N/A",Fixed Price,1.0,Renewable,"#N/A",false,"#N/A","#N/A","#N/A","#N/A"
08941121-fd0f-486f-8166-c3dc98ba11b5,Flat Professional Service Rates for mixed-us.,"#N/A","#N/A",Services,true,Professional Service Hours,SRV-002,"#N/A",Default,One per quote line,"#N/A","#N/A","#N/A",Quantity,One-Time,false,"#N/A","#N/A","#N/A","#N/A","#N/A","#N/A","#N/A","#N/A","#N/A",false,"#N/A","#N/A",false,"#N/A","#N/A",1.0,false,"#N/A","#N/A","#N/A",false,false,false,false,"#N/A",false,false,false,false,false,false,true,false,"#N/A",Click,false,false,false,List,"#N/A",true,"#N/A",false,"#N/A","#N/A",List,"#N/A","#N/A",Fixed Price,1.0,Renewable,"#N/A",false,"#N/A","#N/A","#N/A","#N/A"
09150d6f-52ac-4e7a-b3cd-9c565f6e1340,"Change Control eliminates change activity in server environments that can lead to security breaches, data loss, and outages.","#N/A","#N/A",Software,true,Change Control,SS-001,"#N/A",Default,One per quote line,"#N/A",Monthly,Advance,Quantity,Recurring,false,"#N/A","#N/A","#N/A","#N/A","#N/A","#N/A","#N/A","#N/A","#N/A",false,"#N/A","#N/A",false,"#N/A","#N/A",1.0,false,"#N/A","#N/A","#N/A",false,false,false,false,"#N/A",false,false,false,false,false,false,false,false,"#N/A",Click,false,false,false,List,"#N/A",true,"#N/A",false,"#N/A","#N/A",List,OnPremise,"#N/A","#N/A",12.0,"#N/A","#N/A",false,"#N/A","#N/A","#N/A","#N/A"
0a794748-7e51-4c0d-a6df-fef8279d7bb6,"Intel Xeon E5-2609 v4 1.7GHz,20M Cache,6.4GT/s QPI,Turbo,HT 8C/8T (85W) - Designed for software defined infrastructure supercharged for efficiency, performance, and agile services delivery across cloud-native and traditional applications.","#N/A","#N/A",Hardware,true,Intel Xeon E5-2609 v4 1.7GHz,INTEL E5-2609,"#N/A",Allow Refund,One per quote line,"#N/A","#N/A","#N/A",Quantity,One-Time,true,"#N/A","#N/A","#N/A","#N/A","#N/A",Disabled,"#N/A","#N/A","#N/A",false,"#N/A","#N/A",false,"#N/A","#N/A",1.0,false,"#N/A","#N/A","#N/A",false,false,false,false,Do Not Generate,false,false,false,false,true,false,false,false,Tabs,Click,false,false,false,List,"#N/A",true,"#N/A",false,"#N/A","#N/A",List,Hardware,"#N/A","#N/A","#N/A",One-time,"#N/A",false,"#N/A","#N/A","#N/A","#N/A"
0d7cd4ae-e949-45a8-a39e-189b553ffad0,Data Center Security Suite for Databases gives you complete visibility into your database landscape and security posture.,"#N/A","#N/A",Software,true,Data Center Security Suite,DBS-001,"#N/A",Default,One per quote line,"#N/A",Monthly,Arrears,Quantity,Recurring,false,"#N/A","#N/A","#N/A","#N/A","#N/A","#N/A","#N/A","#N/A","#N/A",false,"#N/A","#N/A",false,"#N/A","#N/A",1.0,false,"#N/A","#N/A","#N/A",false,false,false,false,"#N/A",false,false,false,false,false,false,false,false,"#N/A",Click,false,false,false,List,"#N/A",true,"#N/A",false,"#N/A","#N/A",List,"#N/A","#N/A",Fixed Price,12.0,Renewable,"#N/A",false,"#N/A","#N/A","#N/A","#N/A"
0ebe6708-0b9f-44d9-9db5-684ecdb75291,Application Protection for an unlimited number of applications.,"#N/A","#N/A",Software,true,Application Protection Unlimited,S-SSO-APU,"#N/A",Default,One per quote line,"#N/A",Annual,Advance,Quantity,Recurring,false,"#N/A","#N/A","#N/A","#N/A","#N/A","#N/A","#N/A","#N/A","#N/A",false,"#N/A","#N/A",false,"#N/A","#N/A",1.0,false,"#N/A","#N/A","#N/A",false,false,false,false,"#N/A",false,false,false,false,false,false,true,false,"#N/A",Click,false,false,false,List,"#N/A",true,"#N/A",false,"#N/A","#N/A",List,"#N/A","#N/A",Fixed Price,12.0,Renewable,"#N/A",false,"#N/A","#N/A","#N/A","#N/A"
0f9efac7-7931-4c8e-959d-e2dd82533c7a,Roof Fan Tray promotes bottom to top airflow for an enclosure in zero U of space. It cools by exhausting heat out of the roof of the rack.,"#N/A","#N/A",Hardware,true,Roof Fan Tray 750mm - 208V,BSSA-4308,"#N/A",Allow Refund,One per quote line,"#N/A","#N/A","#N/A",Quantity,One-Time,true,"#N/A","#N/A","#N/A","#N/A","#N/A",Disabled,"#N/A","#N/A","#N/A",false,"#N/A","#N/A",false,"#N/A","#N/A",1.0,false,"#N/A","#N/A","#N/A",false,false,false,false,"#N/A",false,false,false,false,true,false,false,false,Tabs,Click,false,false,false,List,"#N/A",true,"#N/A",false,"#N/A","#N/A",List,Hardware,"#N/A","#N/A","#N/A",One-time,"#N/A",false,"#N/A","#N/A","#N/A","#N/A"
0fc92574-d033-48c0-b8af-ec44cc34edc6,The Power Cord is designed to provide ideal electrical connectivity to your equipments. It operates at 250-Volt voltage range.,"#N/A","#N/A",Hardware,true,C13 to C14 Power Cable 5',CMPC-5888,"#N/A",Allow Refund,One per quote line,"#N/A","#N/A","#N/A",Quantity,One-Time,true,"#N/A","#N/A","#N/A","#N/A","#N/A",Disabled,"#N/A","#N/A","#N/A",false,"#N/A","#N/A",false,"#N/A","#N/A",1.0,false,"#N/A","#N/A","#N/A",false,false,false,false,"#N/A",false,false,false,false,true,false,false,false,Tabs,Click,false,false,false,List,"#N/A",true,"#N/A",false,"#N/A","#N/A",List,Hardware,"#N/A","#N/A","#N/A",One-time,"#N/A",false,"#N/A","#N/A","#N/A","#N/A"
11ca7378-2abe-43ce-91f6-219517693f92,Threat Intelligence Exchange Report Tools allows for audit extraction into data warehouse formats for offline analysis.,"#N/A","#N/A",Software,true,Threat Intelligence Reporting Tools,SM-004,"#N/A",Default,One per quote line,"#N/A",Monthly,Arrears,Quantity,Recurring,false,"#N/A","#N/A","#N/A","#N/A","#N/A","#N/A","#N/A","#N/A","#N/A",false,"#N/A","#N/A",false,"#N/A","#N/A",1.0,false,"#N/A","#N/A","#N/A",false,false,false,false,"#N/A",false,false,false,false,false,false,false,false,"#N/A",Click,false,false,false,List,"#N/A",false,"#N/A",false,"#N/A","#N/A",List,"#N/A","#N/A",Fixed Price,12.0,Renewable,"#N/A",false,"#N/A","#N/A","#N/A","#N/A"
13277d5a-fba5-4d83-98b6-606fe635c459,VirusScan Enterprise safeguards systems and files from viruses and other security risks.,"#N/A","#N/A",Software,true,VirusScan Enterprise,EP-013,"#N/A",Default,One per quote line,"#N/A",Monthly,Arrears,Quantity,Recurring,false,"#N/A","#N/A","#N/A","#N/A","#N/A","#N/A","#N/A","#N/A","#N/A",false,"#N/A","#N/A",false,"#N/A","#N/A",1.0,false,"#N/A",69591f24-7c78-415f-a71d-c09fc856fb08,"#N/A",false,false,false,false,"#N/A",false,false,false,false,false,false,false,false,"#N/A",Click,false,false,false,List,"#N/A",true,"#N/A",false,"#N/A","#N/A",List,"#N/A","#N/A",Fixed Price,1.0,Renewable,"#N/A",false,"#N/A","#N/A","#N/A","#N/A"
137b6409-9a0d-4631-8f34-679074507c06,"Data Normalization Experts engage early in the project and assist customers in normalizing, cleaning, and de-duping data, and can perform upload and update functions.","#N/A","#N/A",Services,true,Data Normalization Expert,SV-DNE,"#N/A",Default,One per quote line,"#N/A","#N/A","#N/A",Quantity,One-Time,true,"#N/A","#N/A","#N/A","#N/A","#N/A","#N/A","#N/A","#N/A","#N/A",false,"#N/A","#N/A",false,"#N/A","#N/A",1.0,false,"#N/A","#N/A","#N/A",false,false,false,false,"#N/A",false,false,false,false,false,false,false,false,"#N/A",Click,false,false,false,List,"#N/A",true,"#N/A",false,"#N/A","#N/A",List,"#N/A","#N/A","#N/A","#N/A",Renewable,"#N/A",false,"#N/A","#N/A","#N/A","#N/A"
14061531-49fd-4cbe-988d-e90c65a03cd6,"#N/A","#N/A","#N/A",Software,true,VirusScan Enterprise for Mac,EP-025,"#N/A",Default,One per quote line,"#N/A",Monthly,Arrears,Quantity,Recurring,false,"#N/A","#N/A","#N/A","#N/A","#N/A","#N/A","#N/A","#N/A","#N/A",false,"#N/A","#N/A",false,"#N/A",Standard,1.0,false,"#N/A",69591f24-7c78-415f-a71d-c09fc856fb08,"#N/A",false,false,false,false,"#N/A",false,false,false,false,false,false,false,false,"#N/A",Click,false,false,false,List,"#N/A",true,"#N/A",false,"#N/A","#N/A",List,"#N/A","#N/A",Fixed Price,1.0,Renewable,"#N/A",false,"#N/A","#N/A","#N/A","#N/A"
157fa578-37a3-485f-8aaf-f2451856f5dc,"Web Gateway Cloud Service eliminates the constraints of on-network web security by connecting users from any device or location to the internet through our cloud, maintaining protection wherever they go.","#N/A","#N/A",Software,true,Web Gateway Cloud Service,WS-002,"#N/A",Default,One per quote line,"#N/A",Monthly,Arrears,Quantity,Recurring,false,"#N/A","#N/A","#N/A","#N/A","#N/A","#N/A","#N/A","#N/A","#N/A",false,"#N/A","#N/A",false,"#N/A","#N/A",1.0,false,"#N/A","#N/A","#N/A",false,false,false,false,"#N/A",false,false,false,false,false,false,false,false,"#N/A",Click,false,false,false,List,"#N/A",true,"#N/A",false,"#N/A","#N/A",List,"#N/A","#N/A",Fixed Price,1.0,Renewable,"#N/A",false,"#N/A","#N/A","#N/A","#N/A"
16d2d31e-2d3b-4e7d-a3f9-1b8f76cdb8ca,"Event Receiver collects and retains large amounts of security data, and gives you immediate access to that data.","#N/A","#N/A",Software,true,Event Receiver,SIEM-006,"#N/A",Default,One per quote line,"#N/A",Monthly,Arrears,Quantity,Recurring,false,"#N/A","#N/A","#N/A","#N/A","#N/A","#N/A","#N/A","#N/A","#N/A",false,"#N/A","#N/A",false,"#N/A","#N/A",1.0,false,"#N/A","#N/A","#N/A",false,false,false,false,"#N/A",false,false,false,false,false,false,false,false,"#N/A",Click,false,false,false,List,"#N/A",true,"#N/A",false,"#N/A","#N/A",List,"#N/A","#N/A",Fixed Price,12.0,Renewable,"#N/A",false,"#N/A","#N/A","#N/A","#N/A"
1a0dc451-e9b5-4c0f-b88c-89abd2e4e340,"Intel Xeon E5-2667 v4 3.2GHz,25M Cache,9.60GT/s 8C/16T (135W) - Designed for software defined infrastructure supercharged for efficiency, performance, and agile services delivery across cloud-native and traditional applications.","#N/A","#N/A",Hardware,true,Intel Xeon E5-2667 v4 3.2GHz,INTEL E5-2667,"#N/A",Allow Refund,One per quote line,"#N/A","#N/A","#N/A",Quantity,One-Time,true,"#N/A","#N/A","#N/A","#N/A","#N/A",Disabled,"#N/A","#N/A","#N/A",false,"#N/A","#N/A",false,"#N/A","#N/A",1.0,false,"#N/A","#N/A","#N/A",false,false,false,false,Do Not Generate,false,false,false,false,true,false,false,false,Tabs,Click,false,false,false,List,"#N/A",true,"#N/A",false,"#N/A","#N/A",List,Hardware,"#N/A","#N/A","#N/A",One-time,"#N/A",false,"#N/A","#N/A","#N/A","#N/A"
1b782273-fb4a-4055-8227-5543f3d14653,Online Single Sign On training for end users includes education and certification modules. Annual Subscription.,"#N/A","#N/A",Services,true,SSO Training Portal for End Users,S-SSO-UTP,"#N/A",Default,One per quote line,"#N/A",Annual,Advance,Quantity,Recurring,false,"#N/A","#N/A","#N/A","#N/A","#N/A","#N/A","#N/A","#N/A","#N/A",false,"#N/A","#N/A",false,"#N/A",Standard,1.0,false,"#N/A","#N/A","#N/A",false,false,false,false,"#N/A",false,false,false,false,false,false,false,false,"#N/A",Click,false,false,false,List,"#N/A",true,"#N/A",false,"#N/A","#N/A",List,"#N/A","#N/A",Fixed Price,12.0,Renewable,"#N/A",false,"#N/A","#N/A","#N/A","#N/A"
1d86f92a-f7dc-4a3f-bab1-05bb841bc5ff,"The PowerSlide server is designed to bring excellent performance, expandability and deployment flexibility to organizations that must deploy multiple integrated servers in a minimum amount of space at a low cost.","#N/A","#N/A",Hardware,true,PowerSlide R750 Rack Server,PS-R750,"#N/A",Allow Refund,One per quote line,"#N/A","#N/A","#N/A",Quantity,One-Time,false,"#N/A",Always,"#N/A","#N/A","#N/A",Allowed,"#N/A",PS-R-{1}{2}{3}{4},"#N/A",false,"#N/A","#N/A",false,"#N/A","#N/A",1.0,false,"#N/A","#N/A","#N/A",false,false,false,false,"#N/A",true,false,false,false,true,false,false,false,Tabs,Click,false,false,false,List,"#N/A",true,"#N/A",false,"#N/A","#N/A",List,Hardware,"#N/A","#N/A","#N/A",One-time,"#N/A",false,"#N/A","#N/A","#N/A","#N/A"
1f01a6f8-5cc1-4a64-9ee4-72e8bd77c41c,"Enterprise Security Manager is a security information and event management (SIEM) solution that delivers actionable intelligence and integrations to prioritize, investigate, and respond to threats. ***Evergreen - Billed Annually***","#N/A","#N/A",Software,true,Enterprise Security Manager (Evergreen),SIEMEG-005,"#N/A",Default,One per quote line,"#N/A",Annual,Advance,Quantity,Recurring,false,"#N/A","#N/A","#N/A","#N/A","#N/A","#N/A","#N/A","#N/A","#N/A",false,"#N/A","#N/A",false,"#N/A","#N/A",1.0,false,"#N/A","#N/A","#N/A",false,false,false,false,"#N/A",false,false,false,false,false,false,false,false,"#N/A",Click,false,false,false,List,"#N/A",true,"#N/A",false,"#N/A","#N/A",List,"#N/A","#N/A",Fixed Price,12.0,Evergreen,"#N/A",false,"#N/A","#N/A","#N/A","#N/A"
21eda709-ec1e-4ab5-8e15-6499abde3f31,"MaxShell cooling, power distribution, and cable management products work seamlessly with IT enclosures to provide a complete infrastructure support system.  Holds 6 rack units (U's) for a vertical storage rack.","#N/A","#N/A",Hardware,true,MaxShell 6U 600mmx870mm,BMX-1051,"#N/A",Allow Refund,One per quote line,"#N/A","#N/A","#N/A",Quantity,One-Time,true,"#N/A","#N/A","#N/A","#N/A","#N/A",Disabled,"#N/A","#N/A","#N/A",false,"#N/A","#N/A",false,"#N/A","#N/A",1.0,false,"#N/A","#N/A","#N/A",false,false,false,false,"#N/A",false,false,false,false,true,false,false,false,Tabs,Click,false,false,false,List,"#N/A",true,"#N/A",false,"#N/A","#N/A",List,Hardware,"#N/A","#N/A","#N/A",One-time,"#N/A",false,"#N/A","#N/A","#N/A","#N/A"
23a5d1f6-3a22-4ffb-b1d0-c9503cbee101,Data Control Manager is a best in class data protection platform that includes asset management and control.,"#N/A","#N/A",Software,true,Data Control Manager (MDQ),DP-004,"#N/A",Default,One per quote line,"#N/A",Monthly,Arrears,Quantity,Recurring,false,"#N/A",Always,"#N/A","#N/A","#N/A",Required,"#N/A","#N/A","#N/A",false,"#N/A","#N/A",false,"#N/A","#N/A",1.0,false,"#N/A","#N/A","#N/A",false,false,false,false,"#N/A",false,false,false,false,false,false,false,false,"#N/A",Click,false,false,false,List,"#N/A",true,"#N/A",false,"#N/A","#N/A",List,"#N/A","#N/A",Fixed Price,1.0,Renewable,"#N/A",false,"#N/A","#N/A","#N/A","#N/A"
246683e2-d60f-4173-b804-99f8e3efc48c,"Intel Xeon E5-2683 v4 2.1GHz,40M Cache,9.60GT/s QPI,Turbo,HT,16C/32T (120W) - Designed for software defined infrastructure supercharged for efficiency, performance, and agile services delivery across cloud-native and traditional applications.","#N/A","#N/A",Hardware,true,Intel Xeon E5-2683 v4 2.1GHz,INTEL E5-2683,"#N/A",Allow Refund,One per quote line,"#N/A","#N/A","#N/A",Quantity,One-Time,true,"#N/A","#N/A","#N/A","#N/A","#N/A",Disabled,"#N/A","#N/A","#N/A",false,"#N/A","#N/A",false,"#N/A","#N/A",1.0,false,"#N/A","#N/A","#N/A",false,false,false,false,Do Not Generate,false,false,false,false,true,false,false,false,Tabs,Click,false,false,false,List,"#N/A",true,"#N/A",false,"#N/A","#N/A",List,Hardware,"#N/A","#N/A","#N/A",One-time,"#N/A",false,"#N/A","#N/A","#N/A","#N/A"
25db7b27-0c6e-441c-9693-111d3dcb6d6f,"Virtual Network Security Platform delivers a complete network security solution ready for the unique demands of private, public, and hybrid clouds.","#N/A","#N/A",Software,true,Virtual Network Security Platform,NS-003,"#N/A",Default,One per quote line,"#N/A",Monthly,Arrears,Quantity,Recurring,false,"#N/A","#N/A","#N/A","#N/A","#N/A","#N/A","#N/A","#N/A","#N/A",false,"#N/A","#N/A",false,"#N/A","#N/A",1.0,false,"#N/A","#N/A","#N/A",false,false,false,false,"#N/A",false,false,false,false,false,false,false,false,"#N/A",Click,false,false,false,List,"#N/A",true,"#N/A",false,"#N/A","#N/A",List,"#N/A","#N/A",Fixed Price,1.0,Renewable,"#N/A",false,"#N/A","#N/A","#N/A","#N/A"
26369526-3800-426b-b13e-1268f6c259b9,"The Program Director provides executive leadership, subject matter expertise, and program oversight.","#N/A","#N/A",Services,true,Program Director,SV-PD,"#N/A",Default,One per quote line,"#N/A","#N/A","#N/A",Quantity,One-Time,false,"#N/A","#N/A","#N/A","#N/A","#N/A","#N/A","#N/A","#N/A","#N/A",false,"#N/A","#N/A",false,"#N/A","#N/A",1.0,false,"#N/A","#N/A","#N/A",false,false,false,false,"#N/A",false,false,false,false,false,false,true,false,"#N/A",Click,false,false,false,List,"#N/A",true,"#N/A",false,"#N/A","#N/A",List,"#N/A","#N/A","#N/A","#N/A",Renewable,"#N/A",false,"#N/A","#N/A","#N/A","#N/A"
269016fe-40c1-44a1-9e8e-38b1be375ee4,"Rack PDU 15A, 120V L5-20 input 5-20 output - Basic Rack Power Distribution Unit allows users to distribute power outlets to rack-mount equipment.","#N/A","#N/A",Hardware,true,"Rack PDU 15A, 120V L5-20",PDU-2024,"#N/A",Allow Refund,One per quote line,"#N/A","#N/A","#N/A",Quantity,One-Time,true,"#N/A","#N/A","#N/A","#N/A","#N/A",Disabled,"#N/A","#N/A","#N/A",false,"#N/A","#N/A",false,"#N/A","#N/A",1.0,false,"#N/A","#N/A","#N/A",false,false,false,false,"#N/A",false,false,false,false,true,false,false,false,Tabs,Click,false,false,false,List,"#N/A",true,"#N/A",false,"#N/A","#N/A",List,Hardware,"#N/A","#N/A","#N/A",One-time,"#N/A",false,"#N/A","#N/A","#N/A","#N/A"
28e07a37-6317-489a-8d8b-fada1c7061b2,"Application Data Monitor detects fraud, data loss, and advanced threats by monitoring all the way to the application layer.","#N/A","#N/A",Software,true,Application Data Monitor,SIEM-002,"#N/A",Default,One per quote line,"#N/A",Annual,Arrears,Quantity,Recurring,false,"#N/A","#N/A","#N/A","#N/A","#N/A","#N/A","#N/A","#N/A","#N/A",false,"#N/A","#N/A",false,"#N/A","#N/A",1.0,false,"#N/A","#N/A","#N/A",false,false,false,false,"#N/A",false,false,false,false,false,false,false,false,"#N/A",Click,false,false,false,List,"#N/A",true,"#N/A",false,"#N/A","#N/A",List,"#N/A","#N/A",Fixed Price,1.0,Renewable,"#N/A",false,"#N/A","#N/A","#N/A","#N/A"
2996dd56-7be3-48fe-8568-4e55774106f6,Our certified Implementation Engineers bring a wealth of application expertise and integration experience to ensure the clients other systems are connected.,"#N/A","#N/A",Services,true,Implementation Engineer,SV-IMP,"#N/A",Default,One per quote line,"#N/A","#N/A","#N/A",Quantity,One-Time,false,"#N/A","#N/A","#N/A","#N/A","#N/A","#N/A","#N/A","#N/A","#N/A",false,"#N/A","#N/A",false,"#N/A","#N/A",1.0,false,"#N/A","#N/A","#N/A",false,false,false,false,"#N/A",false,false,false,false,false,false,true,false,"#N/A",Click,false,false,false,List,"#N/A",true,"#N/A",false,"#N/A","#N/A",List,"#N/A","#N/A","#N/A","#N/A",Renewable,"#N/A",false,"#N/A","#N/A","#N/A","#N/A"
2b71aaad-ddd7-4c09-8f85-c17132711251,"Application Control blocks unauthorized executables on servers, corporate desktops, and fixed-function devices.","#N/A","#N/A",Software,true,Application Control,AC-001,"#N/A",Default,One per quote line,"#N/A",Monthly,Arrears,Quantity,Recurring,false,"#N/A","#N/A","#N/A","#N/A","#N/A","#N/A","#N/A","#N/A","#N/A",false,"#N/A","#N/A",false,"#N/A","#N/A",1.0,false,"#N/A","#N/A","#N/A",false,false,false,false,"#N/A",false,false,false,false,false,false,false,false,"#N/A",Click,false,false,false,List,"#N/A",true,"#N/A",false,"#N/A","#N/A",List,"#N/A","#N/A",Fixed Price,1.0,Renewable,"#N/A",false,"#N/A","#N/A","#N/A","#N/A"
2c258b6b-f0b7-4030-9274-3b9a5cce2d16,"Web Protection uses secure web gateway technology to protect every device, user, and location from sophisticated internet threats.","#N/A","#N/A",Software,true,Web Protection,WS-003,"#N/A",Default,One per quote line,"#N/A",Monthly,Arrears,Quantity,Recurring,false,"#N/A","#N/A","#N/A","#N/A","#N/A","#N/A","#N/A","#N/A","#N/A",false,"#N/A","#N/A",false,"#N/A","#N/A",1.0,false,"#N/A","#N/A","#N/A",false,false,false,false,"#N/A",false,false,false,false,false,false,false,false,"#N/A",Click,false,false,false,List,"#N/A",true,"#N/A",false,"#N/A","#N/A",List,"#N/A","#N/A",Fixed Price,1.0,Renewable,"#N/A",false,"#N/A","#N/A","#N/A","#N/A"
2e14808e-2cf0-4adf-aa6f-58711a3ebded,"Rack PDU 20A, 120V L5-20 input 5-20 output - Basic Rack Power Distribution Unit allows users to distribute power outlets to rack-mount equipment.","#N/A","#N/A",Hardware,true,"Rack PDU 20A, 120V L5-20",PDU-2022,"#N/A",Allow Refund,One per quote line,"#N/A","#N/A","#N/A",Quantity,One-Time,true,"#N/A","#N/A","#N/A","#N/A","#N/A",Disabled,"#N/A","#N/A","#N/A",false,"#N/A","#N/A",false,"#N/A","#N/A",1.0,false,"#N/A","#N/A","#N/A",false,false,false,false,"#N/A",false,false,false,false,true,false,false,false,Tabs,Click,false,false,false,List,"#N/A",true,"#N/A",false,"#N/A","#N/A",List,Hardware,"#N/A","#N/A","#N/A",One-time,"#N/A",false,"#N/A","#N/A","#N/A","#N/A"
