30e18f18-cd57-4e0b-a277-da3d6b321b26,"Vulnerability Manager for Databases automatically discovers databases on your network, determines if the latest patches have been applied, and tests for common weaknesses.","#N/A","#N/A",Software,true,Vulnerability Manager for Databases,DBS-002,"#N/A",Default,One per quote line,"#N/A",Monthly,Arrears,Quantity,Recurring,false,"#N/A","#N/A","#N/A","#N/A","#N/A","#N/A","#N/A","#N/A","#N/A",false,"#N/A","#N/A",false,"#N/A","#N/A",1.0,false,"#N/A","#N/A","#N/A",false,false,false,false,"#N/A",false,false,false,false,false,false,false,false,"#N/A",Click,false,false,false,List,"#N/A",true,"#N/A",false,"#N/A","#N/A",List,"#N/A","#N/A",Fixed Price,12.0,Renewable,"#N/A",false,"#N/A","#N/A","#N/A","#N/A"
313ba320-3b50-4526-ba5e-0b06c58a1126,"#N/A","#N/A","#N/A",Software,true,Endpoint Threat Defense,EP-006,"#N/A",Default,One per quote line,"#N/A",Monthly,Arrears,Quantity,Recurring,false,"#N/A","#N/A","#N/A","#N/A","#N/A","#N/A","#N/A","#N/A","#N/A",false,"#N/A","#N/A",false,"#N/A","#N/A",1.0,false,"#N/A","#N/A","#N/A",false,false,false,false,"#N/A",false,false,false,false,false,false,false,false,"#N/A",Click,false,false,false,List,"#N/A",true,"#N/A",false,"#N/A","#N/A",List,"#N/A","#N/A",Fixed Price,1.0,Renewable,"#N/A",false,"#N/A","#N/A","#N/A","#N/A"
3158cecb-6c35-4be0-ab3e-35729c103260,"Endpoint Threat Protection delivers integrated anti-malware, firewall, web, email, and device control in a single solution. This includes both threat and response solutions.","#N/A","#N/A",Software,true,Endpoint Threat Protection,EP-008,"#N/A",Default,One per quote line,"#N/A",Monthly,Arrears,Quantity,Recurring,false,"#N/A","#N/A","#N/A","#N/A","#N/A","#N/A","#N/A","#N/A","#N/A",false,"#N/A","#N/A",false,"#N/A","#N/A",1.0,false,"#N/A","#N/A","#N/A",false,false,false,false,"#N/A",false,false,false,false,false,false,false,false,"#N/A",Click,false,false,false,List,"#N/A",true,"#N/A",false,"#N/A","#N/A",List,"#N/A","#N/A",Fixed Price,1.0,Renewable,"#N/A",false,"#N/A","#N/A","#N/A","#N/A"
31bd61c2-b577-4e8a-ac5c-1533da8b38c5,Data Control Manager is a best in class data protection platform that includes asset management and control.,"#N/A","#N/A",Software,true,Data Control Manager,DP-004,"#N/A",Default,One per quote line,"#N/A",Monthly,Arrears,Quantity,Recurring,false,"#N/A",Always,"#N/A","#N/A","#N/A",Required,"#N/A","#N/A","#N/A",false,"#N/A","#N/A",false,"#N/A","#N/A",1.0,false,"#N/A","#N/A","#N/A",false,false,false,false,"#N/A",false,false,false,false,false,false,false,false,"#N/A",Click,false,false,false,List,"#N/A",true,"#N/A",false,"#N/A","#N/A",List,"#N/A","#N/A",Fixed Price,1.0,Renewable,"#N/A",false,"#N/A","#N/A","#N/A","#N/A"
399ac0e7-4ef9-4a67-99e5-0f642cc14242,Our Solution Architects are responsible for analyzing customer requirements and designing the optimal solution capabilities.,"#N/A","#N/A",Services,true,Solutions Architect,SV-SAT,"#N/A",Default,One per quote line,"#N/A","#N/A","#N/A",Quantity,One-Time,false,"#N/A","#N/A","#N/A","#N/A","#N/A","#N/A","#N/A","#N/A","#N/A",false,"#N/A","#N/A",false,"#N/A","#N/A",1.0,false,"#N/A","#N/A","#N/A",false,false,false,false,"#N/A",false,false,false,false,false,false,true,false,"#N/A",Click,false,false,false,List,"#N/A",true,"#N/A",false,"#N/A","#N/A",List,"#N/A","#N/A","#N/A","#N/A",Renewable,"#N/A",false,"#N/A","#N/A","#N/A","#N/A"
3aa24afd-52f4-4359-ac9e-7e0cf96a8add,"vSphere Enterprise includes the full range of vSphere features for transforming datacenters into dramatically simplified cloud computing environments providing the next generation of flexible, reliable IT services.","#N/A","#N/A",Software,true,vSphere Enterprise,VMW-E,"#N/A",Allow Refund,One per quote line,"#N/A","#N/A","#N/A",Quantity,One-Time,true,"#N/A","#N/A","#N/A","#N/A","#N/A",Disabled,"#N/A","#N/A","#N/A",false,"#N/A","#N/A",false,"#N/A","#N/A",1.0,false,"#N/A",6f374ce9-43e4-45a1-a501-bbb6d5683999,"#N/A",false,false,false,false,"#N/A",false,false,false,false,true,false,false,false,Tabs,Click,false,false,false,List,"#N/A",true,"#N/A",false,"#N/A","#N/A",List,Software,"#N/A",Fixed Price,1.0,Renewable,"#N/A",false,"#N/A","#N/A","#N/A","#N/A"
3baa22c5-0176-4c76-80b9-bb1cb78997c1,"Enterprise Log Manager collects, compresses, signs, and stores all original events with a clear audit trail of activity that can't be repudiated. ***Renewable/Evergreen - Billed Monthly***","#N/A","#N/A",Software,true,Enterprise Log Manager (Evergreen),SIEMEG-004,"#N/A",Default,One per quote line,"#N/A",Monthly,Advance,Quantity,Recurring,false,"#N/A","#N/A","#N/A","#N/A","#N/A","#N/A","#N/A","#N/A","#N/A",false,"#N/A","#N/A",false,"#N/A","#N/A",1.0,false,"#N/A","#N/A","#N/A",false,false,false,false,"#N/A",false,false,false,false,false,false,false,false,"#N/A",Click,false,false,false,List,"#N/A",true,"#N/A",false,"#N/A","#N/A",List,"#N/A","#N/A",Fixed Price,1.0,Renewable/Evergreen,"#N/A",false,"#N/A","#N/A","#N/A","#N/A"
3c209b9c-4e2a-43a9-ae10-5ae34d502f36,Windows Server Datacenter edition is designed for organizations with large workloads and heavily virtualized server environments.,"#N/A","#N/A",Software,true,Windows Server Datacenter - Onetime License,WIN SDATA-OT,"#N/A",Allow Refund,One per quote line,"#N/A","#N/A","#N/A",Quantity,One-Time,true,"#N/A","#N/A","#N/A","#N/A","#N/A",Disabled,"#N/A","#N/A","#N/A",false,"#N/A","#N/A",false,"#N/A","#N/A",1.0,false,"#N/A","#N/A","#N/A",false,false,false,false,"#N/A",false,false,false,false,true,false,false,false,Tabs,Click,false,false,false,List,"#N/A",true,"#N/A",false,"#N/A","#N/A",List,Software,"#N/A","#N/A","#N/A",Renewable,"#N/A",false,"#N/A","#N/A","#N/A","#N/A"
3ccdb690-945b-482e-b410-ba198a0fec16,"Using an intuitive color-coded rating system, SiteAdvisor Enterprise identifies websites that contain malware or other threats such as spyware or phishing scams, alerting you before you click.","#N/A","#N/A",Software,true,SiteAdvisor Enterprise,EP-012,"#N/A",Default,One per quote line,"#N/A",Monthly,Arrears,Quantity,Recurring,false,"#N/A","#N/A","#N/A","#N/A","#N/A","#N/A","#N/A","#N/A","#N/A",false,"#N/A","#N/A",false,"#N/A","#N/A",1.0,false,"#N/A","#N/A","#N/A",false,false,false,false,"#N/A",false,false,false,false,false,false,false,false,"#N/A",Click,false,false,false,List,"#N/A",true,"#N/A",false,"#N/A","#N/A",List,"#N/A","#N/A",Fixed Price,1.0,Renewable,"#N/A",false,"#N/A","#N/A","#N/A","#N/A"
421f1286-ce81-46c5-b0c9-0f102b261584,"System maintenance, administration, and configuration performed by a certified technician. 15% of hardware.","#N/A","#N/A",Services,true,Silver Hardware Maintenance,SUPP-1000,"#N/A",Default,One per quote line,"#N/A",Annual,Advance,Quantity,Recurring,true,"#N/A","#N/A","#N/A","#N/A","#N/A",Disabled,"#N/A","#N/A","#N/A",false,"#N/A","#N/A",false,"#N/A",Standard,1.0,false,"#N/A","#N/A","#N/A",false,true,false,false,Do Not Generate,false,false,false,false,false,false,true,false,Tabs,Click,false,false,false,List,"#N/A",true,"#N/A",false,"#N/A","#N/A",Net,Hardware,15.0,Percent Of Total,12.0,Renewable,"#N/A",false,Line,"#N/A","#N/A","#N/A"
446632af-5ec4-4c1a-9b5b-978544ec4c7d,"Intel Xeon E5-2603 v4 1.7GHz,15M Cache,6.4GT/s QPI,Turbo,HT 6C/6T (85W) - Designed for software defined infrastructure supercharged for efficiency, performance, and agile services delivery across cloud-native and traditional applications.","#N/A","#N/A",Hardware,true,Intel Xeon E5-2603 v4 1.7GHz,INTEL E5-2603,"#N/A",Allow Refund,One per quote line,"#N/A","#N/A","#N/A",Quantity,One-Time,true,"#N/A","#N/A","#N/A","#N/A","#N/A",Disabled,"#N/A","#N/A","#N/A",false,"#N/A","#N/A",false,"#N/A","#N/A",1.0,false,"#N/A","#N/A","#N/A",false,false,false,false,Do Not Generate,false,false,false,false,false,false,false,false,Tabs,Click,false,false,false,List,"#N/A",true,"#N/A",false,"#N/A","#N/A",List,"#N/A","#N/A","#N/A","#N/A",One-time,"#N/A",false,"#N/A","#N/A","#N/A","#N/A"
49062032-e704-4906-9a06-35f1a9a41c6c,Installation and Assembly of a Maxspace Rack by a Infinity Solution Certified techniction,"#N/A","#N/A",Services,true,Installation and Assembly,INST-1000,"#N/A",Allow Refund,One per quote line,"#N/A","#N/A","#N/A",Quantity,One-Time,true,"#N/A","#N/A","#N/A","#N/A","#N/A",Disabled,"#N/A","#N/A","#N/A",false,"#N/A","#N/A",false,"#N/A","#N/A",1.0,false,"#N/A","#N/A","#N/A",false,false,false,false,"#N/A",false,false,false,false,false,false,false,false,Tabs,Click,false,true,false,List,"#N/A",true,"#N/A",false,"#N/A","#N/A",List,"#N/A","#N/A","#N/A","#N/A",Renewable,"#N/A",false,"#N/A","#N/A","#N/A","#N/A"
4bd73b73-164b-4de1-9652-5deaf5e153a0,"Security for Microsoft SharePoint ensures that your corporate SharePoint deployment does not spread malware, store inappropriate content, or lead to data loss.","#N/A","#N/A",Software,true,Security for Microsoft SharePoint,EP-011,"#N/A",Default,One per quote line,"#N/A",Monthly,Arrears,Quantity,Recurring,false,"#N/A","#N/A","#N/A","#N/A","#N/A","#N/A","#N/A","#N/A","#N/A",false,"#N/A","#N/A",false,"#N/A","#N/A",1.0,false,"#N/A","#N/A","#N/A",false,false,false,false,"#N/A",false,false,false,false,false,false,false,false,"#N/A",Click,false,false,false,List,"#N/A",true,"#N/A",false,"#N/A","#N/A",List,"#N/A","#N/A",Fixed Price,1.0,Renewable,"#N/A",false,"#N/A","#N/A","#N/A","#N/A"
4bf809ab-8d54-4e26-99ec-e58d523ee991,Data Loss Prevention (DLP) Prevent protects against data loss by ensuring that data only leaves the network when appropriate.,"#N/A","#N/A",Software,true,DLP Prevent,DP-008,"#N/A",Default,One per quote line,"#N/A",Monthly,Arrears,Quantity,Recurring,false,"#N/A","#N/A","#N/A","#N/A","#N/A","#N/A","#N/A","#N/A","#N/A",false,"#N/A","#N/A",false,"#N/A","#N/A",1.0,false,"#N/A","#N/A","#N/A",false,false,false,false,"#N/A",false,false,false,false,false,false,false,false,"#N/A",Click,false,false,false,List,"#N/A",true,"#N/A",false,"#N/A","#N/A",List,"#N/A","#N/A",Fixed Price,1.0,Renewable,"#N/A",false,"#N/A","#N/A","#N/A","#N/A"
4f239489-870e-4765-b4a9-168f2918b86d,The 19-inch Black Modular Toolless Blanking Panel allows for quick and easy installation in any EIA-310-D compliant square hole mounting rail rack or enclosure.,"#N/A","#N/A",Hardware,true,Blanking Panel,BSSA-4298,"#N/A",Allow Refund,One per quote line,"#N/A","#N/A","#N/A",Quantity,One-Time,true,"#N/A","#N/A","#N/A","#N/A","#N/A",Disabled,"#N/A","#N/A","#N/A",false,"#N/A","#N/A",false,"#N/A","#N/A",1.0,false,"#N/A","#N/A","#N/A",false,false,false,false,"#N/A",false,false,false,false,true,false,false,false,Tabs,Click,false,false,false,List,"#N/A",true,"#N/A",false,"#N/A","#N/A",List,Hardware,"#N/A","#N/A","#N/A",One-time,"#N/A",false,"#N/A","#N/A","#N/A","#N/A"
5065570a-e7fc-4213-b800-3c86fbef8e17,"Rack PDU 30A, 120V L5-20 input 5-20 output - Basic Rack Power Distribution Unit allows users to distribute power outlets to rack-mount equipment.","#N/A","#N/A",Hardware,true,"Rack PDU 30A, 120V L5-20",PDU-2023,"#N/A",Allow Refund,One per quote line,"#N/A","#N/A","#N/A",Quantity,One-Time,true,"#N/A","#N/A","#N/A","#N/A","#N/A",Disabled,"#N/A","#N/A","#N/A",false,"#N/A","#N/A",false,"#N/A","#N/A",1.0,false,"#N/A","#N/A","#N/A",false,false,false,false,"#N/A",false,false,false,false,true,false,false,false,Tabs,Click,false,false,false,List,"#N/A",true,"#N/A",false,"#N/A","#N/A",List,Hardware,"#N/A","#N/A","#N/A",One-time,"#N/A",false,"#N/A","#N/A","#N/A","#N/A"
520ed4bd-2f25-49f2-a108-5cd725e83688,Investigator guides analysts to the right insights to fully and quickly validate and resolve threats.,"#N/A","#N/A",Software,true,Investigator,ATA-002,"#N/A",Default,One per quote line,"#N/A",Monthly,Arrears,Quantity,Recurring,false,"#N/A","#N/A","#N/A","#N/A","#N/A","#N/A","#N/A","#N/A","#N/A",false,"#N/A","#N/A",false,"#N/A","#N/A",1.0,false,"#N/A","#N/A","#N/A",false,false,false,false,"#N/A",false,false,false,false,false,false,false,false,"#N/A",Click,false,false,false,List,"#N/A",true,"#N/A",false,"#N/A","#N/A",List,"#N/A","#N/A",Fixed Price,1.0,Renewable,"#N/A",false,"#N/A","#N/A","#N/A","#N/A"
529018e6-e364-460e-8e06-b6f24efe7983,"Our certified Module Extension Engineers specialize in configuring and customizing the additional modules to a clients specifications, and work closely with the Core System Engineers.","#N/A","#N/A",Services,true,Module Extension Engineer,SV-MEE,"#N/A",Default,One per quote line,"#N/A","#N/A","#N/A",Quantity,One-Time,false,"#N/A","#N/A","#N/A","#N/A","#N/A","#N/A","#N/A","#N/A","#N/A",false,"#N/A","#N/A",false,"#N/A","#N/A",1.0,false,"#N/A","#N/A","#N/A",false,false,false,false,"#N/A",false,false,false,false,false,false,true,false,"#N/A",Click,false,false,false,List,"#N/A",true,"#N/A",false,"#N/A","#N/A",List,"#N/A","#N/A","#N/A","#N/A",Renewable,"#N/A",false,"#N/A","#N/A","#N/A","#N/A"
5658e359-4695-426b-8e69-8082906cddc1,Subscription for one (1) Single Sign On user.,"#N/A","#N/A",Software,true,SSO Suite Identity Management User License,S-SSO-USER,"#N/A",Default,One per quote line,"#N/A",Monthly,Advance,Quantity,Recurring,false,"#N/A","#N/A","#N/A","#N/A","#N/A","#N/A","#N/A","#N/A","#N/A",false,"#N/A","#N/A",false,"#N/A",Standard,1.0,false,"#N/A",0e3e1f6a-f262-4a95-85ed-e3bcd6b21b42,"#N/A",false,false,false,false,"#N/A",false,false,false,false,false,false,false,false,"#N/A",Click,false,false,false,List,"#N/A",true,"#N/A",false,"#N/A","#N/A",List,"#N/A","#N/A",Fixed Price,1.0,Renewable,"#N/A",false,"#N/A","#N/A","#N/A","#N/A"
56fd0606-17f8-431c-abcd-b52b65601c2e,"Data Loss Prevention (DLP) Discover helps find and remediate sensitive data that resides on your servers, network shares, databases, and in the cloud.","#N/A","#N/A",Software,true,DLP Discover,DP-005,"#N/A",Default,One per quote line,"#N/A",Monthly,Arrears,Quantity,Recurring,false,"#N/A","#N/A","#N/A","#N/A","#N/A","#N/A","#N/A","#N/A","#N/A",false,"#N/A","#N/A",false,"#N/A","#N/A",1.0,false,"#N/A","#N/A","#N/A",false,false,false,false,"#N/A",false,false,false,false,false,false,false,false,"#N/A",Click,false,false,false,List,"#N/A",true,"#N/A",false,"#N/A","#N/A",List,"#N/A","#N/A",Fixed Price,1.0,Renewable,"#N/A",false,"#N/A","#N/A","#N/A","#N/A"
577b5e0f-ac57-4b45-988f-6d0a1981931e,4TB 7.2k RPM NLSAS 12Gps 3.5 in - Industry-leading rotational vibration tolerance design helps ensure consistent performance in dense multi-drive systems,"#N/A","#N/A",Hardware,true,4TB 7.2k RPM NLSAS,HD 4TB,"#N/A",Allow Refund,One per quote line,"#N/A","#N/A","#N/A",Quantity,One-Time,true,"#N/A","#N/A","#N/A","#N/A","#N/A",Disabled,"#N/A","#N/A","#N/A",false,"#N/A","#N/A",false,"#N/A","#N/A",1.0,false,"#N/A","#N/A","#N/A",false,false,false,false,Do Not Generate,false,false,false,false,true,false,false,false,Tabs,Click,false,false,false,List,"#N/A",true,"#N/A",false,"#N/A","#N/A",List,Hardware,"#N/A","#N/A","#N/A",One-time,"#N/A",false,"#N/A","#N/A","#N/A","#N/A"
5cc15ea1-f052-4d84-8de4-34b7cb7c699f,On Premise Maintenance Fees,"#N/A","#N/A",Software,true,Maintenance,SSM-0001,"#N/A",Default,One per quote line,"#N/A",Monthly,Advance,Quantity,Recurring,false,"#N/A","#N/A","#N/A","#N/A","#N/A","#N/A","#N/A","#N/A","#N/A",false,"#N/A","#N/A",false,"#N/A","#N/A",1.0,false,"#N/A","#N/A","#N/A",false,false,false,false,"#N/A",false,false,false,false,false,false,false,false,"#N/A",Click,false,false,false,List,"#N/A",false,"#N/A",false,"#N/A","#N/A",List,OnPremise,20.0,Percent Of Total,12.0,Renewable,"#N/A",false,"#N/A","#N/A","#N/A","#N/A"
5cc4046d-30b6-4320-a6a1-2e86ee77519e,These accessories offer the proper cable management options to meet varying needs.,"#N/A","#N/A",Hardware,true,Cable Management Rings (Qty 10),CMPC-5881,"#N/A",Allow Refund,One per quote line,"#N/A","#N/A","#N/A",Quantity,One-Time,true,"#N/A","#N/A","#N/A","#N/A","#N/A",Disabled,"#N/A","#N/A","#N/A",false,"#N/A","#N/A",false,"#N/A","#N/A",1.0,false,"#N/A",dbf1ded7-e37a-4efc-9dd2-e72599325b75,"#N/A",false,false,false,false,"#N/A",false,false,false,false,true,false,false,false,Tabs,Click,false,false,false,List,"#N/A",true,"#N/A",false,"#N/A","#N/A",List,Hardware,"#N/A","#N/A","#N/A",One-time,"#N/A",false,"#N/A","#N/A","#N/A","#N/A"
5d0c5edd-cf8c-4e72-9491-67270afcc0f0,"VirusScan Enterprise for Linux uses a unique, Linux-based on-access scanner that constantly monitors your system for potential attacks.","#N/A","#N/A",Software,true,VirusScan Enterprise for Linux,EP-014,"#N/A",Default,One per quote line,"#N/A",Monthly,Arrears,Quantity,Recurring,false,"#N/A","#N/A","#N/A","#N/A","#N/A","#N/A","#N/A","#N/A","#N/A",false,"#N/A","#N/A",false,"#N/A",Standard,1.0,false,"#N/A",69591f24-7c78-415f-a71d-c09fc856fb08,"#N/A",false,false,false,false,"#N/A",false,false,false,false,false,false,false,false,"#N/A",Click,false,false,false,List,"#N/A",true,"#N/A",false,"#N/A","#N/A",List,"#N/A","#N/A",Fixed Price,1.0,Renewable,"#N/A",false,"#N/A","#N/A","#N/A","#N/A"
5d1e7e82-762c-4e8c-b42b-55f359cfa194,Subscription for one (1) Single Sign On Administrator.,"#N/A","#N/A",Software,true,SSO Suite Admin License,S-SSO-ADM,"#N/A",Default,One per quote line,"#N/A",Monthly,Advance,Quantity,Recurring,false,"#N/A","#N/A","#N/A","#N/A","#N/A","#N/A","#N/A","#N/A","#N/A",false,"#N/A","#N/A",false,"#N/A",Standard,1.0,false,"#N/A","#N/A","#N/A",false,false,false,false,"#N/A",false,false,false,false,false,false,false,false,"#N/A",Click,false,false,false,List,"#N/A",true,"#N/A",false,"#N/A","#N/A",List,"#N/A","#N/A",Fixed Price,1.0,Renewable,"#N/A",false,"#N/A","#N/A","#N/A","#N/A"
5e907d4b-fc82-4587-b506-35d9c1bf332a,"Intel E5-2690 v4 2.6GHz,35M Cache,9.60GT/s 14C/28T (135W) - Designed for software defined infrastructure supercharged for efficiency, performance, and agile services delivery across cloud-native and traditional applications.","#N/A","#N/A",Hardware,true,Intel E5-2690 v4 2.6GHz,INTEL E5-2690,"#N/A",Allow Refund,One per quote line,"#N/A","#N/A","#N/A",Quantity,One-Time,true,"#N/A","#N/A","#N/A","#N/A","#N/A",Disabled,"#N/A","#N/A","#N/A",false,"#N/A","#N/A",false,"#N/A","#N/A",1.0,false,"#N/A","#N/A","#N/A",false,false,false,false,Do Not Generate,false,false,false,false,false,false,false,false,Tabs,Click,false,false,false,List,"#N/A",true,"#N/A",false,"#N/A","#N/A",List,"#N/A","#N/A","#N/A","#N/A",One-time,"#N/A",false,"#N/A","#N/A","#N/A","#N/A"
5f06b322-8fac-408b-ad8e-7fa6841c0f2d,"MaxShell cooling, power distribution, and cable management products work seamlessly with IT enclosures to provide a complete infrastructure support system.  Holds 8 rack units (U's) for a vertical storage rack.","#N/A","#N/A",Hardware,true,MaxShell 8U 600mmx1070mm,BMX-1050,"#N/A",Allow Refund,One per quote line,"#N/A","#N/A","#N/A",Quantity,One-Time,true,"#N/A","#N/A","#N/A","#N/A","#N/A",Disabled,"#N/A","#N/A","#N/A",false,"#N/A","#N/A",false,"#N/A","#N/A",1.0,false,"#N/A","#N/A","#N/A",false,false,false,false,"#N/A",false,false,false,false,true,false,false,false,Tabs,Click,false,false,false,List,"#N/A",true,"#N/A",false,"#N/A","#N/A",List,Hardware,"#N/A","#N/A","#N/A",One-time,"#N/A",false,"#N/A","#N/A","#N/A","#N/A"
5f2d58c2-188e-435e-8c96-97715042b58a,"Intel E5-2650 v4 2.2GHz,30M Cache,9.60GT/s QPI,Turbo,HT,12C/24T (105W) - Designed for software defined infrastructure supercharged for efficiency, performance, and agile services delivery across cloud-native and traditional applications.","#N/A","#N/A",Hardware,true,Intel E5-2650 v4 2.2GHz,INTEL E5-2650,"#N/A",Allow Refund,One per quote line,"#N/A","#N/A","#N/A",Quantity,One-Time,true,"#N/A","#N/A","#N/A","#N/A","#N/A",Disabled,"#N/A","#N/A","#N/A",false,"#N/A","#N/A",false,"#N/A","#N/A",1.0,false,"#N/A","#N/A","#N/A",false,false,false,false,Do Not Generate,false,false,false,false,false,false,false,false,Tabs,Click,false,false,false,List,"#N/A",true,"#N/A",false,"#N/A","#N/A",List,"#N/A","#N/A","#N/A","#N/A",One-time,"#N/A",false,"#N/A","#N/A","#N/A","#N/A"
5fbdb93a-bb7f-41cb-9cfa-0d9bf2acead3,"System maintenance, administration, and configuration performed by a certified technician. Also includes 24x7 phone service and monthly on-site check-ups. 20% of hardware.","#N/A","#N/A",Services,true,Gold Hardware Maintenance,SUPP-1005,"#N/A",Default,One per quote line,"#N/A",Annual,Advance,Quantity,Recurring,true,"#N/A","#N/A","#N/A","#N/A","#N/A",Disabled,"#N/A","#N/A","#N/A",false,"#N/A","#N/A",false,"#N/A","#N/A",1.0,false,"#N/A","#N/A","#N/A",false,false,false,false,"#N/A",false,false,false,false,false,false,true,false,Tabs,Click,false,false,false,List,"#N/A",true,"#N/A",false,"#N/A","#N/A",Net,Hardware,20.0,Percent Of Total,12.0,Renewable,"#N/A",false,"#N/A","#N/A","#N/A","#N/A"
625f5111-c418-4a16-9bfd-42ab55fde7fe,"MaxShell cooling, power distribution, and cable management products work seamlessly with IT enclosures to provide a complete infrastructure support system.  Holds 10 rack units (U's) for a vertical storage rack.","#N/A","#N/A",Hardware,true,MaxShell 10U 600mmx1200mm,BMX-1053,"#N/A",Allow Refund,One per quote line,"#N/A","#N/A","#N/A",Quantity,One-Time,true,"#N/A","#N/A","#N/A","#N/A","#N/A",Disabled,"#N/A","#N/A","#N/A",false,"#N/A","#N/A",false,"#N/A","#N/A",1.0,false,"#N/A","#N/A","#N/A",false,false,false,false,"#N/A",false,false,false,false,true,false,false,false,Tabs,Click,false,false,false,List,"#N/A",true,"#N/A",false,"#N/A","#N/A",List,Hardware,"#N/A","#N/A","#N/A",One-time,"#N/A",false,"#N/A","#N/A","#N/A","#N/A"
62d8898f-9286-4b97-930d-ba90adb8f2fa,These accessories offer the proper cable management options to meet varying needs.,"#N/A","#N/A",Hardware,true,"Vertical Cable Organizer, 8 Cable Rings",CMPC-5882,"#N/A",Allow Refund,One per quote line,"#N/A","#N/A","#N/A",Quantity,One-Time,true,"#N/A","#N/A","#N/A","#N/A","#N/A",Disabled,"#N/A","#N/A","#N/A",false,"#N/A","#N/A",false,"#N/A","#N/A",1.0,false,"#N/A","#N/A","#N/A",false,false,false,false,"#N/A",false,false,false,false,true,false,false,false,Tabs,Click,false,false,false,List,"#N/A",true,"#N/A",false,"#N/A","#N/A",List,Hardware,"#N/A","#N/A","#N/A",One-time,"#N/A",false,"#N/A","#N/A","#N/A","#N/A"
645cd05d-139f-48e0-a1d3-fdfacd5e5edb,"Enterprise Log Manager collects, compresses, signs, and stores all original events with a clear audit trail of activity that can't be repudiated.","#N/A","#N/A",Software,true,Enterprise Log Manager,SIEM-004,"#N/A",Default,One per quote line,"#N/A",Monthly,Arrears,Quantity,Recurring,false,"#N/A","#N/A","#N/A","#N/A","#N/A","#N/A","#N/A","#N/A","#N/A",false,"#N/A","#N/A",false,"#N/A","#N/A",1.0,false,"#N/A","#N/A","#N/A",false,false,false,false,"#N/A",false,false,false,false,false,false,false,false,"#N/A",Click,false,false,false,List,"#N/A",true,"#N/A",false,"#N/A","#N/A",List,"#N/A","#N/A",Fixed Price,1.0,Renewable,"#N/A",false,"#N/A","#N/A","#N/A","#N/A"
65ef3cc2-9e4d-4178-a281-45dcaafe46ff,Module providing Application Protection for tech stack. Blocks of 5 applications.,"#N/A","#N/A",Software,true,Application Protection Block,S-SSO-APB,"#N/A",Default,One per quote line,"#N/A",Annual,Advance,Quantity,Recurring,false,"#N/A",Always,"#N/A","#N/A","#N/A",Disabled,"#N/A","#N/A","#N/A",false,"#N/A","#N/A",false,"#N/A","#N/A",1.0,false,"#N/A","#N/A","#N/A",false,false,false,false,"#N/A",false,false,false,false,false,false,false,false,"#N/A",Click,false,false,false,Block,"#N/A",true,"#N/A",false,"#N/A","#N/A",List,"#N/A","#N/A",Fixed Price,12.0,Renewable,"#N/A",false,"#N/A","#N/A","#N/A","#N/A"
676df48b-fc9f-429e-895a-7ddb0594fce5,"Security for Email Servers provides award-winning in-memory and incremental on-demand scanning to remove viruses, worms, Trojans, phishing, and other threats from incoming and outgoing email.","#N/A","#N/A",Software,true,Security for Email Servers,AS-001,"#N/A",Default,One per quote line,"#N/A",Monthly,Arrears,Quantity,Recurring,false,"#N/A","#N/A","#N/A","#N/A","#N/A","#N/A","#N/A","#N/A","#N/A",false,"#N/A","#N/A",false,"#N/A","#N/A",1.0,false,"#N/A","#N/A","#N/A",false,false,false,false,"#N/A",false,false,false,false,false,false,false,false,"#N/A",Click,false,false,false,List,"#N/A",true,"#N/A",false,"#N/A","#N/A",List,"#N/A","#N/A",Fixed Price,1.0,Renewable,"#N/A",false,"#N/A","#N/A","#N/A","#N/A"
684977cf-6a98-40d5-b598-c7d751a4ad15,"#N/A","#N/A","#N/A",Services,true,Quick Deploy,SRV-001,"#N/A",Default,"#N/A","#N/A",Invoice Plan,Advance,Quantity,Recurring,false,"#N/A","#N/A","#N/A","#N/A","#N/A","#N/A","#N/A","#N/A","#N/A",false,"#N/A","#N/A",false,"#N/A","#N/A",1.0,false,"#N/A","#N/A","#N/A",false,false,false,false,"#N/A",false,false,false,false,false,false,true,false,"#N/A",Click,false,false,false,List,"#N/A",true,"#N/A",false,"#N/A","#N/A",List,"#N/A","#N/A","#N/A","#N/A",Renewable,"#N/A",false,"#N/A","#N/A","#N/A","#N/A"
6914d8f3-2ecb-40ec-a907-88ba10f0840e,VirusScan Enterprise for Storage ensures business continuity by protecting network-attached storage (NAS) devices against viruses and other malware.,"#N/A","#N/A",Software,true,VirusScan Enterprise for Storage,EP-015,"#N/A",Default,One per quote line,"#N/A",Monthly,Arrears,Quantity,Recurring,false,"#N/A","#N/A","#N/A","#N/A","#N/A","#N/A","#N/A","#N/A","#N/A",false,"#N/A","#N/A",false,"#N/A",Standard,1.0,false,"#N/A",69591f24-7c78-415f-a71d-c09fc856fb08,"#N/A",false,false,false,false,"#N/A",false,false,false,false,false,false,false,false,"#N/A",Click,false,false,false,List,"#N/A",true,"#N/A",false,"#N/A","#N/A",List,"#N/A","#N/A",Fixed Price,1.0,Renewable,"#N/A",false,"#N/A","#N/A","#N/A","#N/A"
6a0c1ce1-370f-4983-a7d7-af0f248dd5ad,"Support and protect your IT equipment with rack enclosures designed for flexible deployments, usability and infrastructure scalability.","#N/A","#N/A",Hardware,true,Maxspace Rack Enclosure,MAXS-1014,"#N/A",Allow Refund,One per quote line,"#N/A","#N/A","#N/A",Quantity,One-Time,false,"#N/A",Always,"#N/A","#N/A","#N/A",Required,"#N/A","#N/A","#N/A",false,"#N/A","#N/A",false,"#N/A","#N/A",1.0,false,"#N/A","#N/A","#N/A",false,false,false,false,"#N/A",false,false,false,true,true,false,false,false,Tabs,Click,false,false,false,List,"#N/A",true,"#N/A",false,"#N/A","#N/A",List,Hardware,"#N/A","#N/A","#N/A",One-time,"#N/A",false,"#N/A","#N/A","#N/A","#N/A"
